{
  "card_id": "20261026_신한_2027전망P5_외환",
  "house": "신한투자증권",
  "report_title": "2027년 경제 및 금융시장 전망: Time of Tempering — Part V. 외환시장",
  "published": "2026-10-26",
  "published_estimated": false,
  "source_file": "processed/reports/20261026_신한_2027전망P5_외환.pdf",
  "topics": [
    "fx_krwusd",
    "us_rate"
  ],
  "views": [
    {
      "topic_id": "fx_krwusd",
      "variable": "krw_usd",
      "direction": "하락",
      "horizon": "단기",
      "target": "1,300원(2026년 4분기~2027년 1분기)",
      "rationale": "2027년 1분기에 반도체 성과급·법인세 납부·배당 관련 기업 환전이 몰리고 한은 인상 효과가 더해져 원화 강세가 정점에 이른다고 봄. 2026년 3분기 외국인 주식 순매도 급감으로 달러 수급 문제는 해소.",
      "page_ref": "p.9, p.11, p.2",
      "conviction": "높음"
    },
    {
      "topic_id": "fx_krwusd",
      "variable": "krw_usd",
      "direction": "상승",
      "horizon": "장기",
      "target": "2027년 말 1,390원(시나리오 1,300~1,450원 이상)",
      "rationale": "2027년 하반기 반도체 기저효과로 한국 이익 증가율이 미국을 밑돌면 한국에서 미국으로 주식자금 이동이 커져 원화가 되돌림. 중장기 균형환율은 1,400원 초반으로 우상향이며 1분기 저점은 균형 대비 7% 하회.",
      "page_ref": "p.8, p.10-11",
      "conviction": "높음"
    },
    {
      "topic_id": "fx_krwusd",
      "variable": "dxy",
      "direction": "횡보",
      "horizon": "장기",
      "target": "달러지수 연간 보합, 하반기 +1.7%",
      "rationale": "미국 성장 둔화·인상 마무리 인식이 달러 약세를 지지하나 AI 수익화 단계의 미국 상대 우위가 하단을 지지해 박스권. 상반기 달러 숨고르기 후 하반기 선택적 달러 강세.",
      "page_ref": "p.2, p.7",
      "conviction": "중간"
    },
    {
      "topic_id": "us_rate",
      "variable": "us_ffr",
      "direction": "횡보",
      "horizon": "장기",
      "target": "하반기 연준 4.00% 동결(상·하단 표기 없음)",
      "rationale": "하반기 미국 금리 우위 요인으로 연준 동결을 전제. 부수적 언급으로 기준(상단/하단)은 명시되지 않음.",
      "page_ref": "p.2",
      "conviction": "낮음"
    }
  ],
  "key_risks": [
    "신용 위험 확산·AI 투자 불안 시 안전자산 선호로 1,450원 이상",
    "미국 소프트웨어 수익화 가속·하드웨어 피크 우려 조기화 시 1,400~1,420원",
    "2027년 하반기 한국 이익 모멘텀 역전형 외국인 이탈"
  ],
  "notes": "성격: 연간 전망서 Part V(파일 14쪽, 파일 p.N = 원문 p.N+71). 환율 결정 기준이 금리차에서 AI 밸류체인 자금 흐름(교역대금 환전·주식자금)으로 이동했다는 프레임(p.3). 분기 경로(p.11): 26.4Q 1,300 → 27.1Q 1,300 → 27.2Q 1,320 → 27.3Q 1,360 → 27.4Q 1,390원. 2027년 말 시나리오(p.11): 기본 1,390, 수익화 우위 1,400~1,420, 선진국 재정 우려 1,300~1,330, 신용 위험 확산·AI 투자 불안 1,450 이상, 동반 호조 1,300~1,340. 균형환율 추정(p.8): IMF 방식 1,323, 직접 추정 1,326~1,359, 해외유출 구조 인정(기준) 1,401원; 9월 균형 대비 4% 하회. 달러/유로 2분기 1.15 정점 후 연말 1.10 초반(p.12), 엔/달러 150엔 선 완만한 하락(p.13), 위안/달러 2026년 평균 6.80→2027년 6.66(p.14). p.7 그림 주석: '26년은 12월 인상 가정'(연준 마지막 인상 시점 가정)."
}
