{
  "card_id": "20261026_신한_2027전망P2_물가",
  "house": "신한투자증권",
  "report_title": "2027년 경제 및 금융시장 전망: Time of Tempering — Part II. 점진적 물가 충격 되돌림",
  "published": "2026-10-26",
  "published_estimated": false,
  "source_file": "processed/reports/20261026_신한_2027전망P2_물가.pdf",
  "topics": [
    "oil"
  ],
  "views": [
    {
      "topic_id": "oil",
      "variable": "wti",
      "direction": "하락",
      "horizon": "장기",
      "target": "2027년부터 WTI 80달러대(미·이란 대규모 충돌이 재개되지 않을 경우)",
      "rationale": "중동 원유 생산 차질이 5월 정점에서 9월 절반 이하로 줄었고 우회 수송으로 통과량이 8할 회복. 2027년부터 비중동 공급 확대가 더해져 유가가 80달러대로 내려갈 것으로 봄. 재비축 수요는 하단을 지지.",
      "page_ref": "p.6",
      "conviction": "중간"
    },
    {
      "topic_id": "oil",
      "variable": "diesel_crack",
      "direction": "축소",
      "horizon": "단기",
      "target": "디젤 격차 정상화 2027년 1분기",
      "rationale": "디젤 소매가-원유 격차가 3분기 2022년 고점을 넘었지만 정제설비 훼손이 제한적이라 원료 회복이 시차를 두고 반영되면 연말~연초 석유제품 수급이 정상화될 것으로 봄.",
      "page_ref": "p.7, p.10",
      "conviction": "낮음"
    }
  ],
  "key_risks": [
    "호르무즈 재차질(원유 공급 상방 위험)",
    "석유제품 공급 정상화 지연(디젤 격차 120달러 이상 지속)",
    "비연료 수입물가 전가(수입물가 5% 이상 지속), 한국·일본 인건비 상승"
  ],
  "notes": "성격: 연간 전망서 Part II(파일 10쪽, 파일 p.N = 원문 p.N+19). 물가 판단: AI발 물가 경로는 제한적이고 2027년 물가는 에너지·공급망·주거비가 결정(p.2). 요인별 정점(p.10 표): 원유 공급 '26.2Q 정점→'27.1Q 정상화, 공급망 압력 '26.4Q→'27.2Q, 근원 상품 '27 중반→'27 하반기, 주거비 점진 둔화. 미국 주거비는 2027년 2% 중반, 유로존 1% 후반으로 둔화 추정(p.9). 주요국 물가는 2027년 초부터 점진 둔화, 중반 이후 안정 가속(p.10)."
}
