{
  "card_id": "20261026_신한_2027전망P4_주요국한국경제",
  "house": "신한투자증권",
  "report_title": "2027년 경제 및 금융시장 전망: Time of Tempering — Part IV. 주요국 및 한국경제",
  "published": "2026-10-26",
  "published_estimated": false,
  "source_file": "processed/reports/20261026_신한_2027전망P4_주요국한국경제.pdf",
  "topics": [
    "kr_govt_bond",
    "kr_alt_re",
    "kr_corp_bond",
    "kr_alt_pd"
  ],
  "views": [
    {
      "topic_id": "kr_govt_bond",
      "variable": "ktb_10y",
      "direction": "하락",
      "horizon": "장기",
      "target": null,
      "rationale": "미래대응기금 중 총괄계정 일부(12.5조원)가 국채발행 축소 재원으로 잡혀 있고 세수 호조로 적자가 줄어 국고채 공급 부담이 완화될 수 있다고 봄. 다만 2027년 총지출은 12.8% 증가.",
      "page_ref": "p.16",
      "conviction": "낮음"
    },
    {
      "topic_id": "kr_alt_re",
      "variable": "kr_pf_loss_rate",
      "direction": "하락",
      "horizon": "장기",
      "target": null,
      "rationale": "부동산 PF 익스포저가 231조원(2023년 말)에서 169조원(2026년 6월 말)으로 줄고 신규 PF가 늘어 정상화 단계에 진입. 공공임대 예산·LH 발주 확대와 반도체 팹 수주로 2027년 건설투자 반등을 예상.",
      "page_ref": "p.20",
      "conviction": "중간"
    },
    {
      "topic_id": "kr_corp_bond",
      "variable": "kr_bbb_spread",
      "direction": "확대",
      "horizon": "장기",
      "target": null,
      "rationale": "금리 인상기 한계기업 비중이 20% 가까이 올랐고 자영업자·가계 취약차주 연체율이 높으며 중소기업도 점진 상승. 성장 수혜가 상위에 집중되는 K자형 구조로 취약 부문 부담 누적.",
      "page_ref": "p.18",
      "conviction": "낮음"
    },
    {
      "topic_id": "kr_alt_pd",
      "variable": "kr_pd_default",
      "direction": "상승",
      "horizon": "장기",
      "target": null,
      "rationale": "고금리 부담이 한계기업·자영업자·중소기업 등 취약 부문에 누적되고 있어 저신용 차주 중심의 부실이 서서히 늘 수 있다고 봄(금융취약성지수는 안정적이나 점검 필요).",
      "page_ref": "p.18",
      "conviction": "낮음"
    }
  ],
  "key_risks": [
    "하반기 수출·재고 사이클 둔화로 성장 속도 조절",
    "금리 인상에 따른 가계 이자 부담과 취약층 연체",
    "공공요금 인상(한전채 특례 2027년 말 일몰)·유류세 정상화에 따른 물가 상방"
  ],
  "notes": "성격: 연간 전망서 Part IV(파일 26쪽, 파일 p.N = 원문 p.N+45). 2027년 전망: 미국 GDP 2.1%·CPI 3.0%(p.5), 유로존 GDP 1.3%·CPI 2.9%(p.9), 중국 GDP 4.1%·CPI 1.2%(p.13), 한국 GDP 2.9%(p.24)·CPI 2% 중반(p.26). 한국: 반도체 소득이 투자·재정·성과급 세 경로로 2027년 내수에 전달(p.14), 반도체 2사 성과급 세후 30조원 중반 추정·즉시 유동화 약 21조원이 금융자산·부동산 수요로 이동 가능(p.17), 2027년 총지출 820.9조원(+12.8%)(p.16), 경상흑자 6,000억달러대 진입 예상(p.23), 반도체 수출 2027년에도 증가(p.22). 미국은 고금리로 건설투자 회복 제약(p.3)."
}
